{
  "$schema": "../../../schema/shift-profile-v1.json",
  "schemaVersion": 1,
  "person": "studenta",
  "set": "offense",
  "name": "Student A offense",
  "description": "Driver-only offense set. Slow is the digital left-trigger click, not analog LEFT_TRIGGER.",
  "controllers": {
    "driver": {
      "slot": 1,
      "defaultLayer": "drive",
      "model": "iwgame-wired-ps5"
    }
  },
  "layers": {
    "drive": {
      "controller": "driver",
      "bindings": [
        {
          "source": "LEFT_STICK_X",
          "intent": "drive.rotation",
          "event": "ANALOG",
          "transform": {
            "deadband": 0.08,
            "exponent": 1.6
          }
        },
        {
          "source": "LEFT_TRIGGER_PRESSED",
          "event": "WHILE_HELD",
          "intent": "drive.slow"
        }
      ]
    }
  }
}
