{
  "$schema": "../../../schema/shift-profile-v1.json",
  "schemaVersion": 1,
  "person": "garrett",
  "set": "general",
  "name": "Garrett general",
  "description": "Driver-only map. Compose with an operator profile at session start. Slow is RIGHT_BUMPER.",
  "controllers": {
    "driver": {
      "slot": 1,
      "defaultLayer": "drive",
      "model": "iwgame-wired-ps5"
    }
  },
  "layers": {
    "drive": {
      "controller": "driver",
      "bindings": [
        {
          "source": "LEFT_STICK_X",
          "intent": "drive.rotation",
          "event": "ANALOG",
          "transform": {
            "deadband": 0.08,
            "exponent": 1.6
          }
        },
        {
          "source": "RIGHT_BUMPER",
          "event": "WHILE_HELD",
          "intent": "drive.slow"
        }
      ]
    }
  }
}
